{"anchors":[{"id":"A1","kind":"recurring_activity_stream","label":"Vue core framework evolution","nodes":["N1","N2"]},{"id":"A2","kind":"project","label":"Vite stewardship","nodes":["N3","N4"]}],"relations":[{"source":"N1","target":"N2","kind":"repeated_context","evidence":["E1","E2"]},{"source":"N3","target":"N4","kind":"practice","evidence":["E3"]}],"motifs":[{"id":"M1","label":"Compatibility-aware framework evolution","kind":"cross_cutting_theme","nodes":["N1","N2","N4"],"evidence":["E1","E3"]}],"galaxies":[{"id":"G1","label":"Vue core API 与框架演进","anchor":"A1","primary_nodes":["N1","N2"],"secondary_nodes":[]},{"id":"G2","label":"Vite 项目 stewardship","anchor":"A2","primary_nodes":["N3","N4"],"secondary_nodes":[]}],"distillation":{"primary_nodes":["N1","N2","N3","N4"],"secondary_nodes":[]}}