{"anchors":[{"id":"A1","kind":"recurring_activity_stream","label":"GPT training implementations","nodes":["N1","N2"]},{"id":"A2","kind":"project","label":"llm.c","nodes":["N3","N4"]},{"id":"A3","kind":"recurring_activity_stream","label":"Executable neural-network understanding and agent research","nodes":["N5","N6"]}],"relations":[{"source":"N1","target":"N2","kind":"repeated_context","evidence":["E1","E2"]},{"source":"N3","target":"N4","kind":"practice","evidence":["E2"]},{"source":"N1","target":"N3","kind":"repeated_context","evidence":["E1","E2"]},{"source":"N5","target":"N1","kind":"repeated_context","evidence":["E1","E3"]},{"source":"N6","target":"N2","kind":"repeated_context","evidence":["E1","E4"]}],"motifs":[{"id":"M1","label":"Small readable implementations as a vehicle for understanding","kind":"cross_cutting_theme","nodes":["N1","N3","N4","N5"],"evidence":["E1","E2","E3"]},{"id":"M2","label":"Explicit separation of human protocol design and agent execution","kind":"provenance","nodes":["N6"],"evidence":["E4"]}],"galaxies":[{"id":"G1","label":"GPT 训练系统与复现实验","anchor":"A1","primary_nodes":["N1","N2"],"secondary_nodes":[]},{"id":"G2","label":"llm.c 低层训练与工程取舍","anchor":"A2","primary_nodes":["N3","N4"],"secondary_nodes":[]},{"id":"G3","label":"可执行理解、教学与 Agent 研究流程","anchor":"A3","primary_nodes":["N5","N6"],"secondary_nodes":[]}],"distillation":{"primary_nodes":["N1","N2","N3","N4","N5","N6"],"secondary_nodes":[]}}