{"anchors":[{"id":"A1","kind":"learning_trajectory","label":"React / React Native learning practice","nodes":["N1","N2"]},{"id":"A2","kind":"learning_trajectory","label":"Exercism practice","nodes":["N3"]},{"id":"A3","kind":"project","label":"Fashion-MNIST self-study baseline","nodes":["N4"]}],"relations":[{"source":"N1","target":"N2","kind":"practice","evidence":["E1"]}],"motifs":[{"id":"M1","label":"Self-directed learning through small public artifacts","kind":"cross_cutting_theme","nodes":["N1","N2","N3","N4"],"evidence":["E1","E2","E3"]}],"galaxies":[{"id":"G1","label":"React / React Native 学习实践","anchor":"A1","primary_nodes":["N1"],"secondary_nodes":["N2"]},{"id":"G2","label":"Exercism 编程练习","anchor":"A2","primary_nodes":["N3"],"secondary_nodes":[]},{"id":"G3","label":"Fashion-MNIST 机器学习自学","anchor":"A3","primary_nodes":["N4"],"secondary_nodes":[]}],"distillation":{"primary_nodes":["N1","N3","N4"],"secondary_nodes":["N2"]}}