{"anchors":[{"id":"A1","kind":"project","label":"FastAPI framework","nodes":["N1","N2"]},{"id":"A2","kind":"recurring_activity_stream","label":"FastAPI / Typer / SQLModel maintenance","nodes":["N3","N4"]}],"relations":[{"source":"N1","target":"N2","kind":"co_occurrence","evidence":["E1"]},{"source":"N3","target":"N4","kind":"repeated_context","evidence":["E2","E3"]}],"motifs":[{"id":"M1","label":"AI-assisted changes with explicit human review and validation","kind":"work_mode","nodes":["N3","N4"],"evidence":["E2","E3"]}],"galaxies":[{"id":"G1","label":"FastAPI 与类型驱动 API 产品","anchor":"A1","primary_nodes":["N1","N2"],"secondary_nodes":[]},{"id":"G2","label":"Python 项目族 stewardship 与验证","anchor":"A2","primary_nodes":["N3","N4"],"secondary_nodes":[]}],"distillation":{"primary_nodes":["N1","N2","N3","N4"],"secondary_nodes":[]}}