{"anchors":[{"id":"A1","kind":"project","label":"bat","nodes":["N1","N2"]},{"id":"A2","kind":"project","label":"hyperfine","nodes":["N3","N4"]},{"id":"A3","kind":"project","label":"Numbat","nodes":["N5","N6"]}],"relations":[{"source":"N1","target":"N2","kind":"practice","evidence":["E1"]},{"source":"N3","target":"N4","kind":"practice","evidence":["E2"]},{"source":"N5","target":"N6","kind":"practice","evidence":["E3"]},{"source":"N2","target":"N3","kind":"repeated_context","evidence":["E1","E2"]}],"motifs":[{"id":"M1","label":"Focused command-line tools with explicit usability boundaries","kind":"cross_cutting_theme","nodes":["N1","N2","N3","N4"],"evidence":["E1","E2"]}],"galaxies":[{"id":"G1","label":"bat 与终端工作流","anchor":"A1","primary_nodes":["N1","N2"],"secondary_nodes":[]},{"id":"G2","label":"hyperfine 与可信基准测量","anchor":"A2","primary_nodes":["N3","N4"],"secondary_nodes":[]},{"id":"G3","label":"Numbat 科学计算语言","anchor":"A3","primary_nodes":["N5","N6"],"secondary_nodes":[]}],"distillation":{"primary_nodes":["N1","N2","N3","N4","N5","N6"],"secondary_nodes":[]}}