{"anchors":[{"id":"A1","kind":"project","label":"Datasette","nodes":["N1","N2"]},{"id":"A2","kind":"project","label":"sqlite-utils","nodes":["N3","N4"]},{"id":"A3","kind":"project","label":"LLM","nodes":["N5","N6"]}],"relations":[{"source":"N1","target":"N2","kind":"co_occurrence","evidence":["E1"]},{"source":"N3","target":"N4","kind":"practice","evidence":["E3","E4"]},{"source":"N5","target":"N6","kind":"co_occurrence","evidence":["E2","E6"]},{"source":"N1","target":"N3","kind":"repeated_context","evidence":["E5"]},{"source":"N3","target":"N5","kind":"repeated_context","evidence":["E5"]}],"motifs":[{"id":"M1","label":"Plugin-oriented extensibility across developer tools","kind":"cross_cutting_theme","nodes":["N1","N3","N5","N6"],"evidence":["E5"]},{"id":"M2","label":"Long-lived independent open-source product maintenance","kind":"work_mode","nodes":["N1","N3","N4","N5"],"evidence":["E1","E2","E3","E4","E6"]}],"galaxies":[{"id":"G1","label":"Datasette 与数据发布产品","anchor":"A1","primary_nodes":["N1","N2"],"secondary_nodes":[]},{"id":"G2","label":"sqlite-utils 与 SQLite 应用工具","anchor":"A2","primary_nodes":["N3","N4"],"secondary_nodes":[]},{"id":"G3","label":"LLM 开发者工具平台","anchor":"A3","primary_nodes":["N5","N6"],"secondary_nodes":[]}],"distillation":{"primary_nodes":["N1","N2","N3","N4","N5","N6"],"secondary_nodes":[]}}