{"anchors":[{"id":"A1","kind":"project","label":"Type-Fest","nodes":["N1","N2"]},{"id":"A2","kind":"project","label":"Ky","nodes":["N3","N4"]},{"id":"A3","kind":"recurring_activity_stream","label":"Awesome curation","nodes":["N5","N6"]}],"relations":[{"source":"N1","target":"N2","kind":"practice","evidence":["E1"]},{"source":"N3","target":"N4","kind":"practice","evidence":["E2","E3"]},{"source":"N5","target":"N6","kind":"practice","evidence":["E4"]},{"source":"N1","target":"N3","kind":"repeated_context","evidence":["E1","E2"]}],"motifs":[{"id":"M1","label":"Focused developer utilities with narrow explicit APIs","kind":"cross_cutting_theme","nodes":["N1","N2","N3","N4"],"evidence":["E1","E2","E3"]},{"id":"M2","label":"Long-running open-source maintenance and curation","kind":"work_mode","nodes":["N1","N3","N5","N6"],"evidence":["E1","E2","E4"]}],"galaxies":[{"id":"G1","label":"Type-Fest 与类型工具设计","anchor":"A1","primary_nodes":["N1","N2"],"secondary_nodes":[]},{"id":"G2","label":"Ky HTTP 客户端与可靠性","anchor":"A2","primary_nodes":["N3","N4"],"secondary_nodes":[]},{"id":"G3","label":"Awesome 开源策展与知识组织","anchor":"A3","primary_nodes":["N5","N6"],"secondary_nodes":[]}],"distillation":{"primary_nodes":["N1","N2","N3","N4","N5","N6"],"secondary_nodes":[]}}