{"anchors":[{"id":"A1","kind":"project","label":"ripgrep","nodes":["N1","N2"]},{"id":"A2","kind":"project","label":"Jiff","nodes":["N3","N4"]},{"id":"A3","kind":"project","label":"memchr","nodes":["N5","N6"]}],"relations":[{"source":"N1","target":"N2","kind":"practice","evidence":["E1","E2"]},{"source":"N3","target":"N4","kind":"practice","evidence":["E3","E4"]},{"source":"N5","target":"N6","kind":"practice","evidence":["E5"]},{"source":"N2","target":"N6","kind":"repeated_context","evidence":["E2","E5"]}],"motifs":[{"id":"M1","label":"Performance with explicit workload boundaries","kind":"cross_cutting_theme","nodes":["N2","N5","N6"],"evidence":["E2","E5"]},{"id":"M2","label":"Correctness-first long-lived Rust library maintenance","kind":"cross_cutting_theme","nodes":["N3","N4","N5","N6"],"evidence":["E3","E4","E5"]}],"galaxies":[{"id":"G1","label":"ripgrep 与搜索工具工程","anchor":"A1","primary_nodes":["N1","N2"],"secondary_nodes":[]},{"id":"G2","label":"Jiff 时间库设计与维护","anchor":"A2","primary_nodes":["N3","N4"],"secondary_nodes":[]},{"id":"G3","label":"memchr 低层搜索原语","anchor":"A3","primary_nodes":["N5","N6"],"secondary_nodes":[]}],"distillation":{"primary_nodes":["N1","N2","N3","N4","N5","N6"],"secondary_nodes":[]}}